{
  "steps": [
    {
      "type": "edu.northwestern.mobiletoolbox.common.data.MtbStepResult",
      "identifier": "I_0",
      "position": 1,
      "startDate": "2022-05-24T16:54:15.351-05:00",
      "endDate": "2022-05-24T16:54:19.696-05:00"
    },
    {
      "type": "edu.northwestern.mobiletoolbox.common.data.MtbStepResult",
      "identifier": "I_1",
      "position": 2,
      "startDate": "2022-05-24T16:54:19.706-05:00",
      "endDate": "2022-05-24T16:54:22.458-05:00",
      "response": 2
    },
    {
      "type": "edu.northwestern.mobiletoolbox.common.data.MtbStepResult",
      "identifier": "I_2",
      "position": 3,
      "startDate": "2022-05-24T16:54:22.461-05:00",
      "endDate": "2022-05-24T16:54:23.548-05:00",
      "response": 2
    },
    {
      "type": "edu.northwestern.mobiletoolbox.common.data.MtbStepResult",
      "identifier": "I_3",
      "position": 4,
      "startDate": "2022-05-24T16:54:23.551-05:00",
      "endDate": "2022-05-24T16:54:25.296-05:00",
      "response": 2
    },
    {
      "type": "edu.northwestern.mobiletoolbox.common.data.MtbStepResult",
      "identifier": "T_1I",
      "position": 5,
      "startDate": "2022-05-24T16:54:25.300-05:00",
      "endDate": "2022-05-24T16:54:29.053-05:00"
    },
    {
      "type": "edu.northwestern.mobiletoolbox.common.data.MtbStepResult",
      "identifier": "P_1a",
      "position": 6,
      "startDate": "2022-05-24T16:54:29.060-05:00",
      "endDate": "2022-05-24T16:54:30.342-05:00"
    },
    {
      "type": "edu.northwestern.mobiletoolbox.common.data.MtbStepResult",
      "identifier": "P_1b",
      "position": 7,
      "startDate": "2022-05-24T16:54:30.346-05:00",
      "endDate": "2022-05-24T16:54:30.447-05:00"
    },
    {
      "type": "edu.northwestern.mobiletoolbox.common.data.MtbStepResult",
      "identifier": "P_1c",
      "position": 8,
      "startDate": "2022-05-24T16:54:30.452-05:00",
      "endDate": "2022-05-24T16:54:35.326-05:00",
      "practice": true,
      "response": 2,
      "score": 1,
      "responseTime": 2406
    },
    {
      "type": "edu.northwestern.mobiletoolbox.common.data.MtbStepResult",
      "identifier": "P_2a",
      "position": 9,
      "startDate": "2022-05-24T16:54:35.333-05:00",
      "endDate": "2022-05-24T16:54:36.600-05:00"
    },
    {
      "type": "edu.northwestern.mobiletoolbox.common.data.MtbStepResult",
      "identifier": "P_2b",
      "position": 10,
      "startDate": "2022-05-24T16:54:36.602-05:00",
      "endDate": "2022-05-24T16:54:36.703-05:00"
    },
    {
      "type": "edu.northwestern.mobiletoolbox.common.data.MtbStepResult",
      "identifier": "P_2c",
      "position": 11,
      "startDate": "2022-05-24T16:54:36.704-05:00",
      "endDate": "2022-05-24T16:54:39.628-05:00",
      "practice": true,
      "response": 1,
      "score": 1,
      "responseTime": 527
    },
    {
      "type": "edu.northwestern.mobiletoolbox.common.data.MtbStepResult",
      "identifier": "P_3a",
      "position": 12,
      "startDate": "2022-05-24T16:54:46.458-05:00",
      "endDate": "2022-05-24T16:54:48.974-05:00"
    },
    {
      "type": "edu.northwestern.mobiletoolbox.common.data.MtbStepResult",
      "identifier": "P_3b",
      "position": 13,
      "startDate": "2022-05-24T16:54:48.979-05:00",
      "endDate": "2022-05-24T16:54:49.082-05:00"
    },
    {
      "type": "edu.northwestern.mobiletoolbox.common.data.MtbStepResult",
      "identifier": "P_3c",
      "position": 14,
      "startDate": "2022-05-24T16:54:49.085-05:00",
      "endDate": "2022-05-24T16:54:52.372-05:00",
      "practice": true,
      "response": 2,
      "score": 1,
      "responseTime": 1008
    },
    {
      "type": "edu.northwestern.mobiletoolbox.common.data.MtbStepResult",
      "identifier": "P_4a",
      "position": 15,
      "startDate": "2022-05-24T16:54:52.380-05:00",
      "endDate": "2022-05-24T16:54:52.906-05:00"
    },
    {
      "type": "edu.northwestern.mobiletoolbox.common.data.MtbStepResult",
      "identifier": "P_4b",
      "position": 16,
      "startDate": "2022-05-24T16:54:52.911-05:00",
      "endDate": "2022-05-24T16:54:53.013-05:00"
    },
    {
      "type": "edu.northwestern.mobiletoolbox.common.data.MtbStepResult",
      "identifier": "P_4c",
      "position": 17,
      "startDate": "2022-05-24T16:54:53.017-05:00",
      "endDate": "2022-05-24T16:54:55.903-05:00",
      "practice": true,
      "response": 2,
      "score": 1,
      "responseTime": 560
    },
    {
      "type": "edu.northwestern.mobiletoolbox.common.data.MtbStepResult",
      "identifier": "P_5a",
      "position": 18,
      "startDate": "2022-05-24T16:54:55.911-05:00",
      "endDate": "2022-05-24T16:54:57.179-05:00"
    },
    {
      "type": "edu.northwestern.mobiletoolbox.common.data.MtbStepResult",
      "identifier": "P_5b",
      "position": 19,
      "startDate": "2022-05-24T16:54:57.184-05:00",
      "endDate": "2022-05-24T16:54:57.287-05:00"
    },
    {
      "type": "edu.northwestern.mobiletoolbox.common.data.MtbStepResult",
      "identifier": "P_5c",
      "position": 20,
      "startDate": "2022-05-24T16:54:57.290-05:00",
      "endDate": "2022-05-24T16:55:00.136-05:00",
      "practice": true,
      "response": 1,
      "score": 1,
      "responseTime": 685
    },
    {
      "type": "edu.northwestern.mobiletoolbox.common.data.MtbStepResult",
      "identifier": "T_2L",
      "position": 21,
      "startDate": "2022-05-24T16:55:00.144-05:00",
      "endDate": "2022-05-24T16:55:01.192-05:00"
    },
    {
      "type": "edu.northwestern.mobiletoolbox.common.data.MtbStepResult",
      "identifier": "A01a",
      "position": 22,
      "startDate": "2022-05-24T16:55:01.203-05:00",
      "endDate": "2022-05-24T16:55:02.472-05:00"
    },
    {
      "type": "edu.northwestern.mobiletoolbox.common.data.MtbStepResult",
      "identifier": "A01b",
      "position": 23,
      "startDate": "2022-05-24T16:55:02.476-05:00",
      "endDate": "2022-05-24T16:55:02.578-05:00"
    },
    {
      "type": "edu.northwestern.mobiletoolbox.common.data.MtbStepResult",
      "identifier": "A01c",
      "position": 24,
      "startDate": "2022-05-24T16:55:02.582-05:00",
      "endDate": "2022-05-24T16:55:03.481-05:00",
      "response": 1,
      "score": 1,
      "responseTime": 577
    },
    {
      "type": "edu.northwestern.mobiletoolbox.common.data.MtbStepResult",
      "identifier": "A02a",
      "position": 25,
      "startDate": "2022-05-24T16:55:03.489-05:00",
      "endDate": "2022-05-24T16:55:04.010-05:00"
    },
    {
      "type": "edu.northwestern.mobiletoolbox.common.data.MtbStepResult",
      "identifier": "A02b",
      "position": 26,
      "startDate": "2022-05-24T16:55:04.012-05:00",
      "endDate": "2022-05-24T16:55:04.113-05:00"
    },
    {
      "type": "edu.northwestern.mobiletoolbox.common.data.MtbStepResult",
      "identifier": "A02c",
      "position": 27,
      "startDate": "2022-05-24T16:55:04.115-05:00",
      "endDate": "2022-05-24T16:55:04.896-05:00",
      "response": 2,
      "score": 1,
      "responseTime": 486
    },
    {
      "type": "edu.northwestern.mobiletoolbox.common.data.MtbStepResult",
      "identifier": "A03a",
      "position": 28,
      "startDate": "2022-05-24T16:55:04.904-05:00",
      "endDate": "2022-05-24T16:55:05.428-05:00"
    },
    {
      "type": "edu.northwestern.mobiletoolbox.common.data.MtbStepResult",
      "identifier": "A03b",
      "position": 29,
      "startDate": "2022-05-24T16:55:05.430-05:00",
      "endDate": "2022-05-24T16:55:05.532-05:00"
    },
    {
      "type": "edu.northwestern.mobiletoolbox.common.data.MtbStepResult",
      "identifier": "A03c",
      "position": 30,
      "startDate": "2022-05-24T16:55:05.536-05:00",
      "endDate": "2022-05-24T16:55:06.439-05:00",
      "response": 1,
      "score": 1,
      "responseTime": 595
    },
    {
      "type": "edu.northwestern.mobiletoolbox.common.data.MtbStepResult",
      "identifier": "A04a",
      "position": 31,
      "startDate": "2022-05-24T16:55:06.447-05:00",
      "endDate": "2022-05-24T16:55:06.973-05:00"
    },
    {
      "type": "edu.northwestern.mobiletoolbox.common.data.MtbStepResult",
      "identifier": "A04b",
      "position": 32,
      "startDate": "2022-05-24T16:55:06.976-05:00",
      "endDate": "2022-05-24T16:55:07.078-05:00"
    },
    {
      "type": "edu.northwestern.mobiletoolbox.common.data.MtbStepResult",
      "identifier": "A04c",
      "position": 33,
      "startDate": "2022-05-24T16:55:07.082-05:00",
      "endDate": "2022-05-24T16:55:07.894-05:00",
      "response": 2,
      "score": 1,
      "responseTime": 502
    },
    {
      "type": "edu.northwestern.mobiletoolbox.common.data.MtbStepResult",
      "identifier": "A05a",
      "position": 34,
      "startDate": "2022-05-24T16:55:07.902-05:00",
      "endDate": "2022-05-24T16:55:09.170-05:00"
    },
    {
      "type": "edu.northwestern.mobiletoolbox.common.data.MtbStepResult",
      "identifier": "A05b",
      "position": 35,
      "startDate": "2022-05-24T16:55:09.177-05:00",
      "endDate": "2022-05-24T16:55:09.280-05:00"
    },
    {
      "type": "edu.northwestern.mobiletoolbox.common.data.MtbStepResult",
      "identifier": "A05c",
      "position": 36,
      "startDate": "2022-05-24T16:55:09.287-05:00",
      "endDate": "2022-05-24T16:55:10.419-05:00",
      "response": 1,
      "score": 0,
      "responseTime": 818
    },
    {
      "type": "edu.northwestern.mobiletoolbox.common.data.MtbStepResult",
      "identifier": "A06a",
      "position": 37,
      "startDate": "2022-05-24T16:55:10.427-05:00",
      "endDate": "2022-05-24T16:55:10.954-05:00"
    },
    {
      "type": "edu.northwestern.mobiletoolbox.common.data.MtbStepResult",
      "identifier": "A06b",
      "position": 38,
      "startDate": "2022-05-24T16:55:10.958-05:00",
      "endDate": "2022-05-24T16:55:11.060-05:00"
    },
    {
      "type": "edu.northwestern.mobiletoolbox.common.data.MtbStepResult",
      "identifier": "A06c",